,name,platform,summary,user_review
1659,Gt Legends,PC,"The golden age of motor sports has returned. Experience one of the world's most exciting racing series in GT Legends, including the legendary touring cars of the 60's and 70's. Collect more then 90 original FiA GTC-TC team vehicles and demonstrate your driving skill on real European racetracks. Original Tracks: Over 25 variations of real tracks like Imola, Monza, Donington and Mondello Park. 5 Difficulty Levels: Ranging from the easy beginner mode to the ultra realistic simulation mode. Career Mode: Win numerous cups and buy your dream car in this challenging mode. Pure Realism: Experience an unequalled level of realism in cooperation with FiA GTC-TC teams, incl. pit stops and car setups. Real Sounds: Sophisticated recording techniques guarantee an authentic acoustic profile for each vehicle. Incredible Graphics: Leading edge graphics technology enabling spectacular special effects and dynamic day and night cycles. Multiplayer Mode: Impress your friends with rare unlockable cars and challenge up to 15 opponents online. [Atari]",7.8
518,Xcom: Enemy Unknown,PC,"Enemy Unknown couples tactical turn-based gameplay with action sequences and on-ground combat. Recruit, specialize and train unique soldiers and manage your personnel. Detect and interrupt the alien threat as you construct and expand your XCOM headquarters. Direct soldier squads in turn-based ground battles and deploy air units such as the Interceptor and Skyranger. The fight spreads around the world as the XCOM team engages in over 70 missions, communicating and negotiating with governments around the world.",8.2
10159,Samba De Amigo,Wii,"Created exclusively for the Wii home video game system, this vibrant new game lets players shake to the beats of a samba-infused soundtrack comprised of popular new songs as well as fan-favourites from the original game. Playing as the grinning, sombrero-topped monkey, Amigo, players shake the Wii Remote and Nunchuk like maracas, in time with the visual beats of the music on-screen. Samba De Amigo is packed with lively stages and a host of colourful characters. [Sega]",8.1
439,Dark Souls Iii,PC,"Developed by Japanese developer FromSoftware, DARK SOULS III is the latest chapter in the DARK SOULS series with its trademark sword and sorcery combat and rewarding action RPG gameplay. Players travel across a wide variety of locations in an interconnected world of unrelenting challenge and deep RPG gameplay as they search for a way to survive the coming apocalypse.",8.5
1163,Joe Danger,PlayStation 3,"[Playstation Network] Take control of Joe Danger, motorbike stuntman, and break world records in this 3D side-scrolling stunt-em-up.",7.7
9252,Star Wars Galaxies: Episode Iii Rage Of The Wookiees,PC,"Be the first to experience Episode III related content in Star Wars Galaxies, a digital download. Explore Kashyyyk - the home planet of the Wookiees is being added as an entirely new adventure planet and space zone. Adventure through over 100 story-driven quests - Join the Wookiees in their fight for freedom against their Imperial-supported Trandoshan slavers or support the Empire in their mission of quelling the spread of the Rebellion! Visit and discover several points of interest and adventure zones including the Wookiee-run tree cities, Trandoshan-controlled slave camps and the safari lands of the affluent Rodians. Pilot new starcraft inspired by Star Wars Episode III: Revenge of the Sith including Anakin’s Jedi Starfighter model. Enhance your character with radical new cybernetic parts that add special abilities and improve your performance in combat. Embark on daring new space mining missions to recover precious raw materials for sale to ground-based crafters. Surviving slews of pirates will provide unprecedented economic opportunities. And experience the all new combat system featuring new weapons, new armor, new effects and an all new user-interface to make combat even more engaging and fun. [LucasArts]",4.2
7559,Yatagarasu: Attack On Cataclysm,PC,"Yatagarasu Attack on Cataclysm is a novel, traditional-style 2D fighting game with eleven playable characters and which aspires to delivering solid game play and high quality production values.",5.0
259,Espn Nfl Football,Xbox,"Sega's latest addition to its NFL 2K series, ESPN NFL Football delivers the most complete NFL experience. Experience a new level of gaming through First Person Football, a mode that allows you to see the game through the eyes of any player on your team. Earn and unlock trophies, mini-games, and music to show off in your Crib. Listen to commentary from ESPN's own Chris Berman and watch the game as if you're watching an ESPN broadcast. Take on your friends or play online.",7.8
907,Pro Evolution Soccer 2017,Xbox One,"In PES 2017, the 1st touch is calculated by player attributes, as well as the further inclusion of real ball physics directly controlled by the input ball touch. See how different players control the ball in unique and different ways based on where and how you control them, dictating the flow of the game based on how they react to the unpredictable movement of the ball. In addition, there is more control in how you receive passes, and depending on the pass, players can visually execute the exact play intended, from receiving a pass to sending the ball out again. [Konami]",5.9
4064,Nfl Fever 2002,Xbox,"NFL Fever 2002 combines fast and hard-hitting action with deep season and career modes. Designed exclusively for Xbox, NFL Fever 2002 features stadiums from all 31 NFL teams and enables gamers to participate in up to 25 seasons. Players can amass both individual and team trophies and build their own dynasties, season after season. The fast-playing NFL tempo lets gamers explode through the holes and break loose, just like real NFL players.",8.3
4506,Deathrow,Xbox,"Enter a brutal fighting sport where only the fastest and toughest players are victorious. Deathrow combines the fast gameplay of third-person action games, the intensity of fighting games, and the cooperative team play and gritty roughness of rugby. The object of Deathrow is to win matches by any means necessary, either by scoring as many points as possible before time runs out or by severely injuring your opponents and removing them from the field of combat. Engage in fierce hand-to-hand combat against your friends, enemies, or intelligent AI opponents that don't just get mad--they get even.",7.8
2943,Tearaway Unfolded,PlayStation 4,"The Tearaway Unfolded Crafted Edition includes a shiny Gold Leaf and a shining Gold Stamp to wear on your messenger, and an exclusive God of War and Journey costumes, allowing you to ‘journey’ through the world of Tearaway Unfolded in style. [Playstation.com]",8.0
764,Plants Vs. Zombies,PC,"Zombies are invading your home, and the only defense is your arsenal of plants! Armed with an alien nursery-worth of zombie-zapping plants like peashooters and cherry bombs, you'll need to think fast and plant faster to stop dozens of types of zombies dead in their tracks. Obstacles like a setting sun, creeping fog and a swimming pool add to the challenge, and with five game modes to dig into, the fun never dies! [Steam]",8.8
8803,Pac-Pix,DS,"One day a mischievous wizard came up with a mysterious invention called “Ghost Ink.” When something is drawn using this ink, it turns into a Ghost. These ghostly tricksters would then jump into pictures and books, to pull pranks and cause havoc around the world. Our hero, Pac-Man, has taken his mighty Magic Pen – the only weapon that can defeat these Ghosts, and locked all the Ghosts inside a book. But before he could turn the Ghosts back into the Ghost Ink, he was also captured within the book! You must now take over Pac-Man’s quest to defeat the mischievous Ghosts. Use the stylus to draw Pac-Man, control his movements to eat up all the Ghosts on the screen. Travel from the lower to the upper screen to collect items and accumulate points. Can you bring peace and quiet back to the world with the Magic Pen? [Nintendo]",7.3
3429,Super Time Force,Xbox One,"Super Time Force is a frantic, hyper-action videogame filled with total mayhem, total madness and total non-stop shooty-shooty-bam-bam destruction. And yet, it also has super sweet, soothing, perhaps even sublime, moments of sloooow motion. Every level in Super Time Force contains 3 mysterious inter-dimensional objects called Shards, which can be used to control the flow of time, slowing it down like velvety smooth molasses, allowing players to unleash a truly heroic level of dodging, weaving, sniping and precision acrobatics.",6.5
27,Resident Evil 4,PlayStation 2,"In Resident Evil 4 players are reacquainted with Leon S. Kennedy, Raccoon City Police Department's idealistic rookie cop from ""Resident Evil 2."" It has been six years since the destruction of Raccoon City and in that time, the U.S. government has been able to destroy the nefarious Umbrella Corporation. Fast forward to 2004 and players rejoin Leon, who is now a U.S. agent with a top-secret mission. He has been tasked to look into the abduction of the President's daughter and his investigation has led him to a mysterious location in Europe. As Leon encounters unimaginable horrors, he must find out who or what is behind everything. [Capcom]",9.0
5331,11-11: Memories Retold,PlayStation 4,"11th November 1916, a young photographer leaves Canada to join the Western Front in Europe. The same day, a German technician is told that his son is missing in action on the front… They will discover the reality of war, crossing paths, on the front, and the rear, trying to preserve their humanity for their loved ones in the face of disastrous events… If they can come back. At 11am the 11th Day of the 11th Month of year 1918, they will face the biggest decision of their lives… This is the moving story of the end of World War One. [Bandai Namco]",7.7
10264,Flock!,Xbox 360,"[Xbox Live Arcade] Protect your cornfields and lock up your livestock, because Flock! is here! Pilot a UFO around vibrantly-colored landscapes in this charming sandbox puzzle game where you must herd animal life back to the Motherflocker. Using a powerful physics engine that drives many of the game's elements, Flock! features over 50 pastoral puzzles. Pick up wood to form bridges, move boulders to create obstructions, and flatten fields into pathways all to help deliver your herd before time runs out! Flock together with a friend and even create and share your own crazy levels online. Animal control: Herd, poke, prod and manipulate cute, cuddly animals that react to each other and their hazardous surroundings. Unique style: Enjoy the whimsical hand stitched and stuffed art style using beautiful next-gen graphics. Level editor: The level editor allows for custom puzzles to be created, shared, and rated. Multiplayer fun: Two-player local co-op lets you flock with a friend. Extras: Explore with lots of fun surprises, secret collectibles, and upgrades to find along the way. [Capcom]",5.6
10665,Last Stop,Switch,"An adventure set in present day London, where you play as three separate characters whose worlds collide in the midst of a supernatural crisis. Last Stop is a single-player third-person adventure set in present day London. Written and developed by Variable State, creators of the award-winning Virginia, Last Stop tells three interconnected tales featuring three playable main characters. Donna, a spaced-out high-schooler who feels trapped by her stifling home life and her overprotective big sister. Away from home, Donna seeks teenage thrills with her friends Becky and Vivek, but gets more than she bargained for when the trio become unexpected kidnappers in a game of amateur detective gone wrong. John, an overworked middle-aged single dad. Burdened with debt and the pressures of being an only parent, John jealously pines after the free and easy life of his twenty-something bachelor neighbour, Jack. When the pair unwittingly fall foul of a vengeful stranger, a cursed artefact threatens to transform their lives forever. Meena, a ruthlessly ambitious professional who struggles to find the same satisfaction with her family that she does in the thrill of her work. As Meena vies with an upstart colleague for a crucial promotion, something ancient stirs in the basement beneath her workplace. Last Stop is fully voice acted, featuring hours of dialogue and a voice cast of dozens, with performances from some of the brightest talent in the UK today, including rising stars Lulu Simpson as Molly Smith and Kassian Akhtar as Dylan Hughes. Last Stop features an original soundtrack by BAFTA award winning composer Lyndon Holland, performed by the Prague Philharmonic Orchestra. Roleplay as 3 unique characters. Make choices to shape their conversations. Walk in their shoes and discover where their individual stories lead.",5.0
13161,X2: Wolverine'S Revenge,PlayStation 2,"Decades ago, a secret orgainzation brainwashed you and implanted a virtually unbreakable adamantium skeleton into your body. Now, as Wolverine - the X-Men's most dangerous weapon - you've discovered you were also implanted with a deadly virus that will kill you within the next 48 hours unless the antidote is found. Your future at risk, you must return to confront your past in an adventure that will take you back to the place you dread most of all - Alkali Lake. Time is running out. [Activision]",7.2
8019,Nfl Blitz 20-03,Xbox,"NFL Blitz returns to the field with it unique brand of hard hits, wild moves, and flying tackles. In this year's installment, you can create your own player and take on the best the NFL has to offer. The game features all your favorite teams, players, and stadiums--all of which are brought to life with more than 1,500 new animations. Take control of real players with ripped physiques and real faces, or have fun with fantasy players in imagined locales.",7.8
9666,Psikyo Shooting Stars Alpha,Switch,"Strikers 1945 A revolution broke out in shooting games in 1995. The Japanese brand ""Psikyo"" introduced a new enemy's attack, ""Spread bullets"" not seen before then, and the history of a new shooting game began. Strikers 1945 II If you went to a video arcade, you might know a certain name. The name is ""Psikyo."" The Psikyo made an awful disaster that called ""Psikyo Bullets."" Many players felt indignation about speedy bullets from enemies and they cried at the end. However, they were attracted to the magical power of ""Psikyo Bullets"" before they know. Psikyo's games were named ""Psikyo Shooting"" by big fans and Psikyo Shooting is divided as a different game genre or not. ""STRIKERS 1945 II"" ... This is also one of the famous works of ""PSIKYO Shooting."" Psikyo is the best choice when you really want to enjoy shooting game! Strikers 1999 Relive the ultra-difficult ""Psikyo"" Shoot 'em up experience! Make use of your fighter's weapons and make your way through a chaotic dogfight!! A shoot 'em up game released by Psikyo in 1999. Make use of Shots, Super Shots, and Support Attacks to make your way through a chaotic dogfight! Historical piston fighters, such as the P-38 Lightning, are ready to rumble!! A state of the art arcade shoot 'em up from the masters of the genre, Psikyo. Players can change various game settings such as game difficulty, and also reproduce the atmosphere of arcade display settings at that time. Players can also compete against each other from all over the world with their high scores. Sol Divide Vorg heard a rumor that the army of Satan was searching for treasures called Seirei stones which led him to think that the time for revenge has come. In addition, he also knows that one of the Seirei stones was entrusted secretly to King Silverna from Vorg's homeland, the Kingdom of Miltia. Vorg, who was a holy knight in Miltia, was in the forest town of Neraphai working for a mission when the king of Satan, Ifter, invaded the Kingdom of Miltia with Dhatilos armies. Upon hearing the news, Vorg immediately returned to Miltia, but the kingdom has been destroyed. After 7 years, a dark shadow went into the royal room inside the Silverna castle. That dark shadow was Satan, Ifter. Vorg heads to Silverna castle with his Helos. Satan owns the Sol Divide which is the pair of heilos. The tale of magic, sword, and vengeance starts now!! Dragon Blaze Earth, Water, Fire, Wind, Moon, and Sun. These four magic stones and the gods of the moon and sun brought prosperity in Megalith. Because of that, the people lived a peaceful and prosperous life. However, their peaceful life ended when Nebiros and his armies appeared. A long time ago, during the war of the gods when the world was created, Nebiros was defeated by the gods of the sun and moon. He was locked up by the 4 magic stones but was freed by summoning a country which aims to achieve victory in the war using him. Nebirus, as an act of revenge, controlled the mind of the god of the moon using his dark power. The god of the universe transformed people's form and spirit into hideous ones and made them as his armies. And the entire Megalith fell into the abyss of destruction and chaos. Nebirus' army has started to move towards the god of the sun. The god of the sun, who was threatened by Nebirus' move, entrusted the weapons of the gods to 4 dragon knights and ordered them to overthrow Nebirus. Zero Gunner 2 Let's blast off every enemy's planes from various sides of your screen. Fans who have enjoyed Psikyo Shooting will definitely enjoy this Zero Gunner 2.",6.4
11245,The Testament Of Sherlock Holmes,PlayStation 3,"The famous detective Sherlock Holmes is back on the PC, PS3, and Xbox 360 for a great adventure and probably the most dangerous investigation of his entire career.",7.3
12126,Romancing Saga 2,Xbox One,"Romancing SaGa 2, originally released only in Japan in 1993, has been completely remastered and now receives its first ever official English translation! No two players will experience the story in the same way The SaGa series is one of Square Enix's most beloved. The first three titles were originally branded overseas under the ""FINAL FANTASY LEGEND"" moniker , and garnered critical acclaim for their complex yet compelling combat system. Romancing SaGa 2 takes the varied gameplay of other entries in the series and combines it with an open-ended free-form scenario system whose story is as vast as the world in which it plays out. The player takes the role of a succession of emperors, painting the history of the world with each and every action. Familiar series hallmarks such as formations and glimmers make a return in this unique title. Story It all begins with the song of a lone bard in a bustling pub. Great nations such as the Varennes Empire, which had once ensured peace throughout the world, stagnated and atrophied over the course of centuries, and sinister forces started emerging in outlying areas. Ere long, peace spiraled into war and the common folk spoke in hushed words of the Seven Heroeshistorical figures who saved the world once and who, it was hoped, would do so again. Additional Elements *New dungeons *New classes: diviner and ninja *New Game+ *Autosave *UI specifically designed for smartphones Android 4.2.2 or above recommended. Not compatible with all devices.",7.5
3434,Life Is Strange: Episode 5 - Polarized,Xbox One,"In Episode 5: Polarized Max learns that time is impossible to control as she moves inexorably towards the most agonizing decision of her life. Arcadia Bay, meanwhile, is preparing to weather a huge storm as Life is Strange comes to a gripping and gut wrenching conclusion.",8.3
1533,Tetris,PSP,[PSP Minis] Tetris on the PSP.,7.7
8940,Nosferatu: The Wrath Of Malachi,PC,"Delivering a blend of atmospheric survival horror and intense first person shooter action, Nosferatu: The Wrath of Malachi immerses players in the terror of an ancient, gothic castle full of vampires. With the monstrous undead lurking around every corner, players must search through the shadowy halls and dank dungeons of a massive castle to free their imprisoned friends and family...failure to rescue the prisoners will not only result in their death, but in the resurrection of an ancient supernatural being who will threaten all of mankind. [iGames]",7.5
1087,Borderlands 2: Tiny Tina'S Assault On Dragon Keep,Xbox 360,"Wizards and Crumpets, oh my! Join vault hunters, old and new, in Tiny Tina's epic quest of revenge and redemption. Tiny Tina’s Assault on Dragon Keep, the biggest add-on content in Borderlands history, features a game within a game, as Tiny Tina takes on the role of Bunker Master in a game of “Bunkers & Badasses”. Travel through a dark and ever-changing world of castles, dungeons and magic forests as you fight off skeletons, orcs, dragons and more. Explore side missions and answer riddles as you roll your insight stat to gain new and amazing loot. Join with friends to save the queen and restore peace and order to the world once more.",8.3
14982,Motocross Mania 3,PC,Mania has spread across the land as people have turned traditional motocross racing into an intense blood sport. Furious combat mixes with fast paged racing through deadly courses that range from populated city streets to harsh open environments. Mania is here and ready to fight. The winner is the one to make it across the finish line still in one piece.,3.3
13761,Mega Man: Battle Chip Challenge,PSP,"The Mega Man series enters the card-battling arena in Mega Man Battle Chip Challenge. You'll play a young boy named Lan who owns a unique device known as a ""Net-Navi."" The evil WWW organization threatens to disrupt cyberspace and, with the help of your Net-Navi, you must upload Mega Man--armed with destructive viruses--into the system. Your weapons consist of battle cards and chips, which you can power up. The ultimate battle for Net Domination begins as you fight your way to the Battle Chip Grand Prix solo or compete with up to two players via the Game Link cable.",8.7
12340,The Grim Adventures Of Billy & Mandy,Wii,"The Grim Adventures of Billy & Mandy videogame pits 15 characters from the popular television show against each other in a fighting/adventure game filled with mayhem and chaos. Whether players use Billy's gas attack or Mandy's deadly smile, all of the characters will feature individual abilities based on their personalities. Players will be able to smash objects, destroy environments and battle in 20 fully interactive environments from the show. In battle mode, up to four players can use a multitude of weapons in destructible arenas like the ""Desert of Doom"" and the ""Underworld"" to battle it out and be the last one standing. Players also have the option to play on their own or with a friend in mission mode, a series of 45 missions where players can unlock new weapons and characters like Hoss Delgado and Fred Fredburger. [Midway]",6.1
11606,Pagan Online,PC,"Pagan Online is a fast-paced hack-and-slash action RPG that will challenge your skill in brutal and satisfying combat against countless enemies and larger than life bosses. Master all heroes, each with their own unique playstyle, solo or online for greater challenges and greater rewards.",5.0
2069,Resident Evil Hd Remaster,PlayStation 4,In 1998 a special forces team was sent to investigate some bizarre murders on the outskirts of Raccoon City. Upon arrival they were attacked by a pack of blood-thirsty dogs and were forced to take cover in a nearby mansion. But the scent of death hung heavy in the air. Supplies were scarce as they struggled to stay alive.,8.5
2543,Blur,Xbox 360,"Blur is a new style of powered-up racing. The game drops players into heart-pumping racing action with 20 cars on a track all targeting the finish line and battling each other as they trade paint and collect intense power-ups, including the ability to blast other cars out of the way with huge bursts of energy, boost their speed, and more. Gamers can use offensive and defensive attacks as they battle for the lead and careen through real-world track locations ranging from L.A. and San Francisco to the streets of Hackney, UK and the treacherous roads of Barcelona, Spain. Beyond the action-packed racing filled with fast curves, sneaky alternate routes, hair-raising jumps and fully realized damage models that provide for spectacular crashes, Blur’s narrative is presented through Bizarre’s new community-based interface, reaching far beyond the game itself. This unique story-driving social network evolves dynamically as players compete in different races, make new friends, rivals and fans, and connect with other racers both in-game and in real life. Looking beyond Blur's single player story, gamers can engage in competitive and team-based multiplayer races with up to 20 players online, or on a single console via 4-player split-screen. Bizarre has also introduced Blur’s original social gaming experience - Custom Groups, where anyone can create unique multiplayer modes based on their favorite ways to play the game. These new modes are immediately shared through Blur’s social network, expanding the game in ways that are only limited by the gaming community’s creativity. [Activision]",8.3
1453,Yakuza 0,PlayStation 4,"The story follows Kazuma Kiryu as a junior yakuza member who finds himself in a heap of trouble when a simple debt collection goes upside down and his mark ends up murdered. Meanwhile, Goro Majima is living a ""normal"" life as the proprieter of a cabaret club, but is doing whatever it takes to rejoin the yakuza. What that entails isn't exactly easy.",8.5
