,name,platform,summary,user_review
2614,Okamiden,DS,"Taking place many months after the events of Okami, Okamiden follows the adventures of Chibiterasu - a young sun god who is summoned to protect and restore the land. Armed with a majestic celestial brush and a vibrant cast of partners with unique powers and abilities, this little god is ready to make its mark on the world.",8.3
11775,Indiana Jones And The Staff Of Kings,PSP,"Step into the shoes of the legendary hero, Indiana Jones, in an all new epic adventure! Set in the year 1939, Indiana Jones and the Staff of Kings follows the rogue archaeologist on an all-new globe-trotting quest. From San Francisco's Chinatown to the lush jungles of Panama, Indy must use his whip, fists and wits to fight through ruthless opposition as he spars with his nemesis, Magnus Völler, in a race for a relic of biblical proportions - the Staff of Moses. Indiana Jones and the Staff of Kings features completely interactive environments, where players need to call upon their wits and daring to make each spring-loaded environment a weapon in order to dispense of foes in clever and unexpected ways. Also, embark upon thrilling action sequences that remain true to the spirit established in scenes such as Indy's pursuit of the motorcade in Raiders of the Lost Ark, the mine-cart scene in Indiana Jones and the Temple of Doom, and the free-for-all aboard the tank in Indiana Jones and the Last Crusade. The PSP system version features a variety of robust types of burst gameplay including combat and physics challenges, puzzles and the trademark Indiana Jones chase sequences.[LucasArts]",7.5
14963,R.I.P.D. The Game,PSP,"Based on the 3D supernatural action-adventure film, R.I.P.D., you and a partner assume the roles of two lawmen dispatched to the otherworld to protect and serve the living from an increasingly destructive series of souls who refuse to move peacefully to the other side. Honed teamwork and an arsenal of killer weapons are the keys to defeating your enemies and bringing serenity back to the world.",3.4
14703,Bubsy: The Woolies Strike Back,PlayStation 4,"Watch Bubsy glide like a bat, jump like a jack rabbit, bounce like a red rubber ball and run…run Bubsy run. This is the Bubsy adventure you were born to play.",5.5
487,The Walking Dead: Episode 5 - No Time Left,PC,"Assume the role of Lee Everett, a convicted criminal, who has been given a second chance at life in a world infested with the undead. With corpses returning to life and survivors stopping at nothing to maintain their own safety, protecting an orphaned girl named Clementine may offer him redemption in a world gone to hell.",8.8
9625,Aliens: Fireteam Elite,PC,"2202. A mysterious distress call reroutes your Marine Assault Unit to LV-895 in the outer colonies, where deadly Xenomorph legions, hidden corporate secrets, and ancient alien ruins await your arrival. Set in the iconic Alien universe, Aliens: Fireteam is a cooperative third-person survival shooter that drops your fireteam of hardened marines into a desperate fight to contain the Xenomorph threat. Face off against waves of terrifying Xenomorph and Weyland-Yutani Synthetic foes alongside two players or AI teammates, as you and your fireteam desperately fight your way through four unique campaigns that introduce new storylines to the Alien universe. Create and customize your own Colonial Marine, choosing from an extensive variety of classes, weapons, gear and perks, battling overwhelming odds in this heart-pounding survival shooter experience. THE ULTIMATE HUNT Play a pivotal role in the epic events that occur 23 years after the original Alien trilogy as a Colonial Marine stationed aboard the USS Endeavor, battling terrifying Xenomorph threats. SURVIVE THE HIVE Face overwhelming odds against over 20 enemy types, including 11 different Xenomorphs along the evolutionary scale from Facehuggers to Praetorians, each designed with their own intelligence to ambush, outsmart and eviscerate vulnerable marines. CUSTOMIZE YOUR FIRETEAM Choose from five unique classes - Gunner, Demolisher, Technician, Doc and Recon - each with their own special abilities and character perks. Utilize an extensive arsenal of 30+ weapons and 70+ mods/attachments in your effort to eradicate the Alien threat.",5.7
12011,Hunting Simulator 2,Xbox One,"With your hunting dog by your side, explore the Texan desert and forests of Colorado and Europe as you track down 33 animal species. Choose your gear from over 160 official weapons, accessories and clothing items (including Browning, Winchester and Bushnell).",5.3
2459,Madden Nfl 18,PlayStation 4,"Madden NFL 18 takes a significant visual leap with the power of the Frostbite engine. See stunning new stadium exteriors surrounded by vast cityscapes and watch the spectacle of NFL gameday come to life in the most photorealistic game to date. Play each matchup to your specifications by selecting from three new Play Styles or play the best real world match ups each week in Play Now Live! With the introduction of even more ways to play, coupled with your modes, Madden Ultimate Team and Franchise, this is Madden like you've never seen before.",3.4
2325,Wipeout Fusion,PlayStation 2,"It's WipEout time again, with the fourth instalment of the critically acclaimed series exploding onto PlayStation 2. Once again you must push your reactions and abilities to the limit in order to leave your rivals in the dust. With 45 futuristic race circuits to negotiate, WipEout Fusion will have you corkscrewing, jumping, barrel-rolling and looping like never before. Other enhancements include the addition of the Endurance and Zone modes, superior AI and the option to customise craft handling to match each course. [Sony Europe]",8.5
339,Mvp Baseball 2004,PlayStation 2,"Step up to the plate with MVP Baseball 2004. The fundamentals of hitting, pitching, fielding, and base running have been reproduced like never before to give you complete control over every aspect of the game. From swinging for the fences or protecting the plate when you have a two-strike count, the all-new batting model provides unprecedented command of each type of swing in every situation. With great gameplay and many additional features such as Pitching Challenge and Dynasty Mode, MVP Baseball 2004 wins the pennant as the most innovative and realistic baseball experience ever created. Groundbreaking Hitting Control: From hitting to the opposite field to pulling the ball down the line to swinging for the fences, every swing type is included. You Control the Field: Leap over the wall and rob home runs, hook slide to avoid tags, and take out the catcher at home with all-new player control. Pick Your Park: With all-new crowd chants, the addition of classic stadiums, and new lighting to signify various start times for your biggest games, MVP Baseball 2004 puts you in the best seat in the house. Your Dynasty Begins Now: Take full control of your franchise on all the levels -- from the minors to the pros. Play, sim, or manage each game all the way to the World Series. Swing for the Fences Online: Go yard against players across the country in one-on-one or Tournament games, while talking up your game with EA SPORTS? Talk [Electronic Arts]",8.5
9982,"The Chronicles Of Narnia: The Lion, The Witch And The Wardrobe",PlayStation 2,"The Chronicles of Narnia: The Lion, The Witch and The Wardrobe is an action adventure based on the Disney and Walden Media film capturing the book series from author C.S. Lewis. Players enter the world of Narnia, a land frozen in eternal winter by the evil powers of the malevolent and evil White Witch. In order to end this frigid captivity and free his people, the mighty lion Aslan, true ruler of Narnia, invokes an ancient prophecy. It will become the destiny of four young siblings from our world: Peter, Susan, Edmund and Lucy Pevensie to work together and use their unique combat skills, weaponry and abilities to defeat the Witch and her armies and save Narnia. These four unlikely heroes must battle the evil forces of the White Witch by waging war against a vast variety of creatures, including Centaurs, Minotaurs, Minoboars, Cyclops, Werewolves, Wraiths, Ankleslicers, Wolves, Satyrs, Boggles and more. Battle the evil forces of the White Witch by waging war against a huge variety of creatures, including Centaurs, Minotaurs, Minoboars, Cyclops, Werewolves, Wraiths, Ankleslicers, Wolves, Satyrs, Boggles and more. Utilize the unique combat skills, weaponry and special moves of each character to fight and fend off hordes of dark mythical beasts, or solve intricate puzzles and progress through the adventure. Two-player action featuring all four characters. [Disney Interactive]",8.2
14071,Enemy Front,Switch,"Enemy Front is the realistic tale of a hardened soldier dropped behind Nazi lines to engage in dynamic, diversified missions ranging from quick skirmishes, espionage assignments, and sabotage activities. The epic scope of Enemy Front spans several years and key battles as it progresses from the trenches of a desolate France right on through to Berlin and a secret weapons base. Once there, the player must thwart the plans for a terrifying weapon that will all but assure a global Nazis victory.",5.6
8517,Xeodrifter,Switch,"Drifting through the stars. Xeodrifter is the story of an interstellar drifter traveling the stars on a simple mission of exploration. We join our nomad as he embarks on the investigation of a small cluster of four planets in the omega sector, after a collision with a rogue asteroid damaged his warp core. Blast your way through alien landscapes, seek out valuable secrets, and defeat ancient guardians to unlock powers from a legendary supreme culture in this exciting journey of mystery and adventure.",5.9
15231,Pulse Racer,Xbox,"Pulse Racer takes you to a future where racers careen toward the clouds in sleek vehicles to gain an advantage over the competition. As a racer, you'll need a risk-taking mentality; but more importantly, you'll need a vehicle that suits your driving style and a driver who matches your technique. Linked directly to your vehicle, your body will be pushed to the limit in a variety of high-speed tracks. Harass your opponents with missiles, mines, or direct plasma beams and slingshot around tight turns.",2.2
3063,Empires: Dawn Of The Modern World,PC,"From renowned game designer Rick Goodman and respected game developer Stainless Steel Studios comes a detailed RTS that lets you completely command unique, historically accurate civilizations?from China to Germany and the United States. From the Middle Ages to World War II, lead your nation to dominate the globe. Each civilization's strengths and weaknesses affect the gameplay experience. Your ability to adapt to these differences is only one of the challenges you will face as a world leader. [Activision]",7.9
8570,Beyond Blue,Xbox One,"Beyond Blue takes players into the near future, where they will have the opportunity to explore the mysteries of our ocean through the eyes of Mirai, a deep-sea explorer and scientist. She and her newly-formed research team will use groundbreaking technologies to see, hear, and interact with the ocean in a more meaningful way than has ever been attempted. The game features an evocative narrative and exploration of an untouched world. Embracing the same inclusive development process that was used to create Never Alone (Kisima Ingitchuna), E-Line’s BAFTA award-winning game about Alaska Native culture, the company partnered with BBC Studios (developers of the acclaimed Blue Planet II), OceanX Media, world-class game makers, and some of science’s leading ocean experts to craft an experience that reflects the awesome wonder and unbounded mystery that infuses our planet’s beating blue heart.",6.8
10962,Tamagotchi Connection: Corner Shop 2,DS,"In Tamagotchi Connection: Corner Shop 2, shop owners must keep their bizarrely adorable Tamagotchi partners happy by earning “Gotchi points” through performing mini-game tasks for the customers. Gotchi points can be used to clothe, feed, and care for your Tamagotchi partners. As more points are collected, new types of shops for players to open will become unlocked. Shops not seen in the original such as the Bowling Alley and Sushi Bar will be available, as well as upgrades to old favorites like the Concert Hall where players can sing along to the music with the DS’ microphone. In Tamagotchi Connection: Corner Shop 2, catering to the needs of your customers will be essential in keeping the Tamagotchi happy. The five different happiness levels will determine the dialogue that occurs between the player and their Tamagotchi partner, and nobody likes a grumpy Tamagotchi. [Namco Bandai]",5.8
11025,Inferno Pool,PlayStation 3,"This isn't Pool as you know it. Multiplayer mayhem awaits 1-4 local or online players, in a race to clear the most balls from your table. Pot balls to fire at your opponents, or stockpile balls to unleash an onslaught. Master Jump Shots, Combos, Bank Shots, Kick Shots and build your multiplayer with an unbroken potting streak to unleash the devastating Inferno Mode. Alliances will be formed, friends will be betrayed, and the battle isn't over until the stat screen appears. [Dark Energy]",6.6
5781,Master X Master,PC,"Experience MXM's unique Tag System and quickly swap between two chosen Masters mid-combat, offering a new level of strategy, combos and tactics to master the battlefield.",7.6
14283,Spider-Man 3,PlayStation 2,"Possess the never-before-experienced powers of Black-Suited Spider-Man. Unleash incredible agility, amazing durability and awe-inspiring web abilities. But be warned - the rush your intensified powers bring could overwhelm you. More freedom than ever. More city than ever. For the first time, enjoy unprecedented freedom—choosing what you want to do, when you want to do it. There's no checklist to complete in order to progress. You set your own next goal, roaming anywhere you want - including subterranean areas such as subways, sewers and villains' lairs - in the most massive, detailed New York City ever seen in a Spider-Man game. Experience an all-new combat system, two exciting ways. Redesigned from the ground up, a unique combat system empowers both Spider-Man and Black-Suited Spider-Man to perform suit-specific powers and abilities. State of the art animations, combos and finishers make punch, kick and web attacks more super-heroic than ever. Battle 10 of Spider-Man’s most infamous enemies from the movie and Marvel universe, including Sandman and Venom. [Activision]",6.6
2301,Sega Ages: Sonic The Hedgehog 2,Switch,"Super Speed! Sonic's back and better than ever. He's a blur in blue! A blaze of action! With his new Super Spin Dash. And a new, fabulous friend, ""Tails"" the Fox. You won't believe it 'til you see it. And when you play, you won't stop. Super Play! Defy gravity in hair-raising loop-de-loops. Grab Power Sneakers and race like lightning through the mazes. All at break-neck speed! Super Power! Sonic's attitude is can-do. The mad scientist Dr. Robotnik is planning a world takeover. Sonic gets tough in the fight to save his friends and squash Robotnik for good!",8.0
1121,Guitar Hero World Tour,Wii,"Guitar Hero World Tour marries Guitar Hero's guitar gameplay, with a cooperative band experience that combines the most advanced wireless instruments with revolutionary new online and offline gameplay modes. The game features a slick newly redesigned guitar, a genuine electronic drum kit and a microphone, as well as an innovative Music Studio music creator that lets players compose, record, edit and share their own rock and roll anthems, along with online Band Career and 8-player ""Battle of the Bands."" Guitar Hero World Tour is comprised entirely of master recordings from some of the greatest classic and modern rock bands of all-time including Ozzy Osbourne, Van Halen, Linkin Park, The Eagles, Sublime and many more. Additionally, the game offers significantly more localized downloadable music than ever before on all of the next-generation consoles. Budding rock stars are also given creative license to fully customize everything from their characters’ appearance and instruments to their band’s logo and album covers. Featuring three drum pads, two raised cymbals and a bass kick pedal, the drum controller combines larger and quieter, velocity-sensitive drum heads with soft rubber construction to deliver authentic bounce back and is easy to set up, move, break down and store. Virtual musicians can live out their rock and roll fantasies by playing either a single instrument, or any combination of instruments, in addition to the full band experience. Guitar Hero World Tour introduces Battle of the Bands mode which allows eight players to join online and challenge each other band-to-band to determine who is the best of the best. In the Band modes, up to four players can jam together, online or off, as they progress through the game, and in single-player Career Mode, players can jam on any of the instruments in branching venue progression enabling them to rock out in the order of their choice. The game's Music Studio lets players express their musical creativity by giving them access to a full compliment of tools to create digital music from scratch, utilizing all of the instruments, and then play their compositions in the game. Music creators can share their recordings with their friends online through GHTunes where other gamers can download their unique compositions and play them. [Activision]",7.5
4877,Dissidia 012: Duodecim Final Fantasy,PSP,Check out new tales of these new warriors and an enhanced battle system.,8.3
2471,Motoheroz,Wii,MotoHeroz is a side-scrolling platform racer game for WiiWare.,7.5
11647,Zoo Tycoon 2: Endangered Species,PC,"Endangered Species brings some of the world's rarest animals home to your zoo. This expansion pack for Zoo Tycoon 2 adds a slew of exotic new content for a zookeeper just like you. Treat yourself and your guests to breathtaking overhead views from the new sky trams. Or drive through your exhibits in the new Jeep vehicle tours. Build bridges and observation decks for a refreshing new view of your animals. And that’s not all. There are also erupting volcanoes, new endangered-species-themed buildings and scenery, and a whole new set of challenges and campaigns. [Microsoft]",7.6
8291,Dirt 5,PC,"Take a trip around the world to and race on over 70+ unique routes across 10 different global locations in stunning environments complete with dynamic weather and time of day. Get behind the wheel of an eclectic and exciting roster of cars. World-renowned voice talents troy baker and nolan north head up the cast of dirt 5's story-driven Career mode. Local split-screen of up to four players on offline modes, including Career, makes dirt 5 the perfect couch multiplayer racing game as you battle for position with your friends. Capture your biggest jumps and best moves with a detailed photo mode, and show your creative flair with dirt's deepest ever livery editor for all cars.",4.2
2609,Fifa Soccer 2002,PlayStation 2,"With all-new ""open passing,"" you have more control and precision than ever before. Find a breaking forward with a perfect 40-yard ball into open space, embarrass the tightest defense with cunning one-twos, or fool any keeper with deep swerving crosses. [Electronic Arts]",6.2
8288,Flotilla,PC,Flotilla is a turn-by-turn space action exploration game.,7.3
12742,Karateka,Xbox 360,Jordan Mechner returns to game development for the first time since Prince of Persia: Sands of Time with a downloadable remake of his Apple II action hit from 1984.,6.7
351,Ncaa Football 2002,PlayStation 2,"Gamers can select from any of 117 Division 1-A or 27 Division 1-AA teams. Play-by-play and color commentary are provided by ESPN's Brad Nessler, Lee Corso and Kirk Herbstreit. Brand-new team-specific playbooks emulate actual college plays run by 117 Division 1-A teams. [EA Sports]",8.4
9840,Metal Slug 4 & 5,Xbox,"Now you can play two of your arcade favorites without any quarters, since Metal Slug 4 and 5 have come to the PlayStation 2 in one complete package. Join Marco and a cast of other Metal Slug characters as they battle corrupt forces in the air, on the sea, and on land. Use power-ups, special weapons, health, and ammo to try to keep up with each game's nonstop action and challenging enemies. Of course, you can also test-drive the next generation of Metal Slug vehicles.",7.9
7038,Midway Arcade Treasures 2,Xbox,"Midway Arcade Treasures 2 brings 20 classic arcade games back to next-generation consoles. This compilation includes such favorites as Mortal Kombat 1, 2, and 3, Spy Hunter 2, Gauntlet 2, NARC, Cyber-Ball, Wizard of Wor, Primal Rage, Steel Talons, Arch Rivals, and more. Each game can provide hours of retro-gaming entertainment. Midway Arcade Treasures 2 also features a documentary on the origins of these games.",6.7
9174,Sniper Elite V2,PlayStation 3,Sniper Elite V2 is a third person tactical WWII shooter and the sequel to 2005's Sniper Elite.,6.8
3463,Red Dead Redemption: Liars And Cheats,PlayStation 3,"Red Dead Redemption: Liars and Cheats introduces Stronghold, a team based Competitive Multiplayer Mode, and the Explosive Rifle, a new, destructive addition to the arsenal.",7.8
3465,Hot Shots Golf Fore!,PlayStation 2,"(Also known as ""Minna No Golf 4,"" or ""Everybody's Golf 4"") Join in on the off-the-wall fun, true-to-life physics and new Online gameplay. With more courses and more characters than ever before Hot Shots Golf FORE! delivers more of what HSG fanatics have grown to love. Join a full cast of off-the-wall characters from the Clubhouse. 34 in all. Enjoy a variety of 15 different courses, from challenging 18-hole layouts, par 3 executive courses, and back by popular demand, Miniature Golf. Breathtaking graphics feature fully detailed course layouts with tree-lined fairways, manicured greens and treacherous hazards. Brilliant lighting effects and dramatic camera angles add energy and drama to spectacular shots and untimely 'shanks'. True-to-life golf physics and touch sensitive controls demand your careful consideration to golf?s many variables, such as wind, ball lie and course elevation. Intuitive controls and adjustable difficulty settings provide easy access for hackers and challenging gameplay for seasoned veterans. Fast paced arcade style gameplay eliminates waiting for load times...or slow foursomes. Test your golf skills in several different modes including, Tour, VS, and Training modes. Online play...Share the course with thousands of Hot Shots Golf fanatics from across the nation. [Sony]",8.4
2140,Magic: Duels Of The Planeswalkers 2014,Xbox 360,"Available on the Android platform for the first time ever in addition to iPad, Xbox LIVE Arcade, Steam and PlayStation Network, Magic 2014 - Duels of the Planeswalkers will offer players exciting new features as they partner with Planeswalker Chandra Nalaar to track down a manipulative and dangerous Planeswalker foe. An immersive storyline and strong integration with the Magic 2014 - Core Set ties the experience together for players, culminating in an end-of-summer Magic Celebration that brings all Magic fans together in stores across the world.",5.5
10870,Vaporum,Xbox One,"Vaporum is a grid-based dungeon crawler RPG in an original steampunk setting, inspired by old-school classics of the genre. Stranded in the middle of an ocean, in front of a gigantic tower, the hero has to find out what the place is, what happened there, and most importantly, who he is.",7.3
150,Guitar Hero Ii,Xbox 360,"Rock the Rhythm, Lead, and Bass Guitar tracks in the follow-up sequel to ""Guitar Hero."" Form your guitar duo and shred riffs cooperatively or go head to head in all new multiplayer modes. With over 55 tracks to rock out to, you'll go from Guitar Hero to Guitar god in one press of a fret button. Choose from multiple rock characters and jam at concert venues that grow in size as your rock career progresses. You'll start your rock career playing small clubs and bars, but if you play well you'll work your way up to stadiums and arenas. Guitar Hero II takes the guitar rock experience to new volumes by allowing players to play 3 different guitar tracks: Rhythm, Bass, and Lead. Guitar Hero II introduces all new multiplayer modes like: cooperative, pro-face off, and face off, letting 2 Guitar Heroes conduct their own symphonies of destruction. Shred School: Guitar Hero II features an all new practice mode, allowing Guitar Zeroes to become Guitar Heroes with enough practice. With Guitar Hero II for Xbox 360 rock rhythm, lead, or bass guitar tracks with downloadable content and the new X-Plorer controller, designed specifically for the Xbox 360. [RedOctane]",8.1
7885,Beyond: Two Souls,PlayStation 4,"Live the life of Jodie Holmes, a young woman who possesses supernatural powers through her psychic link to an invisible entity. Experience the most striking moments of Jodie's life as your actions and decisions determine her fate. As she traverses the globe, Jodie will face incredible challenges against a backdrop of emotionally-charged events never before seen in a video game.",7.9
6820,Naruto: Clash Of Ninja Revolution,Wii,"(Also known as ""Naruto: Clash of Ninja MVZ"") A head-to-head fighting game based on episodes from VIZ Media's anime series SHONEN JUMP NARUTO and includes characters that have never been featured in the Clash of Ninja game series. The game takes advantage of the Wii Remote in fast-paced ninja action for up to four players in nine different gameplay modes. The game allows players to launch attacks with the Wii Remote using Ninja-like movements, and features special mini-games created exclusively for use with the Wii Remote. [D3 Publisher of America]",7.9
