,name,platform,summary,user_review
15220,Game Party,Wii,"Game Party for the Wii is a collection of classic skill games from around the world, from American sports venues to European gathering spots. Using the Wii’s unique control interface, you can play classics such as darts; modern favorites such as table hockey and hoop shoot, or participate in multiplayer trivia contests. More than a half dozen games are available. [Midway]",3.9
6291,Ea Sports Ufc 3,PlayStation 4,"Real Player Motion - New cutting-edge animation technology makes every move, strike, and combination more realistic, responsive, and rewarding. G.O.A.T. Career Mode - Build hype to gain fans and create rivalries that capture the world’s attention. Then fight to dominate the Octagon. Multiplayer Mode - New customizable multiplayer modes let you and your friends face off with highlight-reel knockouts.",4.1
12055,Star Trek: Voyager Elite Force Expansion Pack,PC,"Activision's simple and straightforward add-on pack for 2000's wildly popular Trek shooter may be a little lean on the single-player experience, though 5 new multi-player modes and the ability to explore all 10 levels of the U.S.S. Voyager could make a Trekkie's day.",7.5
6161,Resident Evil Archives: Resident Evil,Wii,"You take control of S.T.A.R.S. Alpha team members Chris Redfield and Jill Valentine (both recently seen in the smash hit, Resident Evil 5). Your mission is to investigate the ominous mansion at the core of the horrific disaster and uncover the secrets behind a radical, genetic research facility. With unspeakable horrors lurking around every corner, the ultimate test will be to make it out alive! Relive the thrills and terror that defined the genre of Survival Horror and launched a franchise that has sold over 40 million games worldwide. [Capcom]",8.7
4202,Shin Megami Tensei: Devil Summoner 2: Raidou Kuzunoha Vs. King Abaddon,PlayStation 2,"A new threat to Japan's Capital calls for the return of its case-solving, tube-slinging Devil Summoner: Raidou Kuzunoha the 14th. When a woman walks into the Narumi Detective Agency and asks to find a man, Raidou's boss is reluctant to accept, but soon it's clear there's more to the case than it seems on the surface. It isn't long before Raidou is on the trail of crooked gamblers, masked ninja, and strange insects... a trail leading him inexorably to the mysterious King Abaddon. Massively upgraded battle system - Advancements to the battle mechanics include a MAG balancing system, dodge and hide abilities, and the ability to command two demons in combat. Use the retooled Weapon Alchemy system to create new swords with unique special attacks. Deeper demon integration - Demon negotiation returns with more than twice the number of demons to attempt to recruit to your side. Create more powerful demons through fusion and skill transfer. Control two demons in battle and choose from more tactical options. [Atlus USA]",3.3
4768,Shin Megami Tensei: Digital Devil Saga,PlayStation 2,"(Known in Japan as ""Digital Devil Saga: Avatar Tuner"") Junkyard, a town of endless rain. With his four companions, Serf, the main character and a member of a tribe called Embryon, sets out for Nirvana, a land that can only be reached by the champions of Junkyard. They devote themselves to fighting against the never-ending resistance mustered by other tribes. In the midst of chaos, a mysterious object, the Pod, suddenly appears. Countless spheres of light are emitted by the Pod and infect Serf and his comrades, awakening their demonic powers. An unimaginable battle unfolds within their faint conscience. They develop a desire to tear the flesh and shatter the bones of their enemies, who have also been transformed. Their instincts tell them to devour every being in their path. Until then, Serf and his comrades only knew of battle, but for the first time, they experience new emotions. At that time, a dark-haired girl, Sera, comes to their rescue. Although she does not know where she came from, she holds a strange power - the power to control the party's demonic transformation. They receive orders from the Church of Karma to head for Nirvana, and they are accompanied by the dark-haired girl. ""They who reach Nirvana first shall be recognized as the champions of Junkyard."" The struggle intensifies, and they discover that the girl holds a key to the mystery. But, true fear still awaits Serf's party. Including Embryon, the tribe that the main character leads, several groups are at war with each other in order to survive. ""Devour"" your enemies and absorb their devastating powers and special abilities! [Atlus]",4.3
5483,Tropico 4,Xbox 360,"Tropico 4 sees you return as El Presidente, the tyrannical (or benevolent) dictator of the island paradise of Tropico. The world is changing and Tropico is moving with the times Ã¯Â¿Â½ geographical powers rise and fall and the world market is dominated by new players with new demands and offers -- and you, as El Presidente, face a whole new set of challenges. If you are to triumph over your naysayers you will need to gain as much support from your people as possible. Your decisions will shape the future of your nation, and more importantly, the size of your Swiss bank account.",7.6
3838,Rollercoaster Tycoon: Loopy Landscapes,PC,"From Rocket Ships and Medieval Castles to Winter Wonderlands and new environments, you now have a complete working palette to create your next thrill-a-minute masterpiece. Build on new landscapes, provide more shops and stalls or take on one of 30 new scenarios filled with new exciting challenges. This expansion two pack also includes Corkscrew Follies. NOTE: This is an add-on pack and requires a copy of the main RollerCoaster Tycoon game to play. [Hasbro Interactive]",8.7
2882,Kingdom Hearts Hd 2.5 Remix,PlayStation 3,KINGDOM HEARTS HD 2.5 ReMIX is an HD remastered compilation of KINGDOM HEARTS II FINAL MIX and KINGDOM HEARTS Birth by Sleep FINAL MIX.,8.9
14865,Things On Wheels,DS,"[Xbox Live Arcade] Things on Wheels is a racing game that will make you scream for more. Take your favorite RC car and race inside an Art Deco house, or around the huge park. Play for fun with your friends, or compete for victory with top-ranked experts. Slide around turns from the music room to the winter garden, and try three different racing experiences with vintage, muscle, and sports vehicles. Take your chances online and use our all-new race lobby, then use bonuses to bend the race to your advantage, and brag about it using audio chat. Don't be afraid to get ToWed away!",6.0
12070,Wrc 5,PlayStation 4,"In WRC 5, you can start to drive at early morning, in the middle of the day, during the sunset or even during the night. These different moments of the day allow you to experience various atmospheres (morning fog, dazzling sunset) and the headlights’ ramp will be very useful for the night stages.",5.8
13422,Nascar 08,PlayStation 2,"Take the wheel and drive your way to the NASCAR Nextel Cup Series championship. As the new rookie driver on the circuit, develop your racing skills to gain licenses and contracts from hungry owners and unlock legendary top performing cars from NASCAR's biggest stars. Gain new experiences during every race then modify your car's handling with over 40 tuning options to truly master every track. Share your setups with NASCAR's gaming community, then challenge the field in live races with up to 16 players online. Experience tomorrow's racing today in NASCAR 08. [Electronic Arts]",7.9
12776,Final Exam,PlayStation 3,"Playable alone and in cooperative mode (local & online), Obscure lets you play as one of four unlikely heroes; students, each with unique skills and abilities that develop throughout the adventure. Geared toward action and all-out brawling, Obscure's combat emphasizes combos, follow-up attacks, and score-multipliers! Survive against packs of monsters trying to skin you alive, discover new weapons, and complete objectives throughout a variety of huge, non-linear levels. Overshooting the scores will earn you experience points to level your character up, unlocking new weapons, skills, and other devastating abilities! At any time, you can even get back to some of earlier levels to try your new toys and beat your scores!",4.9
6417,Magic: The Gathering - Duels Of The Planeswalkers 2012,Xbox 360,"Building on the success of the original Duels of the Planeswalkers, Duels of the Planeswalkers 2012 will introduce all new game modes, Planeswalker opponents, decks, puzzle challenges and other exciting new features including a new-to-digital multiplayer game mode called Archenemy where players gather up to two allies and team up against the AI.",7.9
12615,Wars And Warriors: Joan Of Arc,PC,"Play as Joan of Arc. Live out the most exciting years in the life of Joan of Arc, the ultimate female warrior, in the ultimate epic battles! As you progress through her campaigns, other great military medieval leaders will join your cause and bring their own unique fighting abilities and characteristics into the fray. Fight Epic Battles. Orchestrate your troops through eight massive maps featuring formidable strongholds, lavishly detailed cities and myriad landscapes, from rolling hills to thick forests and flowing rivers. Experience firsthand the sheer intensity and savage brutality of medieval castle sieges brought to life in amazing lifelike 3D. Engage in Intense Action Fighting. Slash and slay enemies from a thrilling third-person perspective view. Wield the sword to your advantage by executing unique combo attacks with perfect timing to devastate the enemy. Acquire New Weapons. Train yourself to master new fighting techniques to unleash your full fighting capabilities, then acquire an increasingly devastating arsenal of weaponry to overwhelm your foes. [Enlight Software]",7.4
9938,The Technomancer,Xbox One,"Spiders are back with The Technomancer, a new post-apocalyptic RPG set in a cyberpunk world for PlayStation 4, Xbox One and PC set on Mars during the War of Water, where an aspiring Technomancer faces a myriad of questions as his future grows threatened by the secrets of his past.",7.1
14560,Pokemon Dash,Xbox 360,"Help Pikachu race to the finish line in Pokemon Dash, the first Pokemon title for the Nintendo DS. Using the touch screen, keep Pikachu running toward the finish line by rubbing the screen in the direction you want the Electric-type Pokemon to go. The faster you rub, the faster Pikachu runs. The gameplay takes place from an overhead perspective, with on-screen arrows to guide you to Poké Ball checkpoints along the way. [Nintendo]",5.2
3069,Planetside,PC,"PlanetSide is a Massively Multiplayer Online First-Person Shooter involving thousands of players fulfilling all the roles needed to wage war across the face of ten gigantic continents. The war involves infantry, ground vehicles, and air battles in a science-fiction setting. Gamers play as any of the three global empires, each group struggling against one another to dominate each base, continent, and ultimately, the planet, for their Empire. [Sony Online Entertainment]",7.3
14064,Skatebird,PlayStation 4,"Grind on bendy straws, kick-flip over staplers, and carve killer lines through cardboard and sticky tape parks. Above all else, skate birds try their best. Grind on bendy straws, kick-flip over staplers, and carve killer lines through cardboard and sticky tape parks! You're a lonely lil' bird, and your Big Friend has hung up their board for good. Their job sucks, and lately, they're barely ever home to play with you. You're gonna fix all that with the power of being a chill little skateboarding bird. You may be tiny, but the more you skate, the more following you get, the more the world of bird skating will open up. Birds will come check out your park, help you find more parks, and together you'll (somehow) fix Big Friend's life! Above all else, skate birds try their best! - Explore lots of bird-sized parks, with simple controls familiar to any pro skating tiny hawk. - Find fancy clothing, secret mixtapes of new music, birbs that need your help, and more! - Skate to an original low-fi birb-hop soundtrack, and unlock new tracks from underground bands as you explore the world!",2.2
14350,Pac-Man And The Ghostly Adventures,PC,"Pac-Man and the Ghostly Adventures has players take the role of Pac and his 2 best friends, Spiral and Cylindria, as they must rise to the challenge of protecting their homeland from the menacing ghosts that have escaped from the Netherworld.",5.1
8818,Gods Eater Burst,PSP,Gods Eater Burst is the enhanced successor of the PSP hit God Eater.,8.0
11206,Dynasty Warriors 8,Xbox 360,"Dynasty Warriors 8 is a tactical action game that follows the stories of the kingdoms of Wei, Wu, Shu and Jin through the actions of historical military and political figures of the time as they fight to wrest control over the Three Kingdoms of China.",7.6
13566,Watchmen: The End Is Nigh,Wii,"[Xbox Live Arcade] The lines between good and evil have been blurred and crime and terror run rampant in the streets. The alleys, rooftops, and sewers are crawling with criminals and brutal gangs. And now, Underboss - in a daring escape - has broken out of prison and is ruling with vicious darkness. The city is in need of saviors and only masked hero vigilantes answer the call. Answer the call in Watchmen: The End Is Nigh. Two Watchmen characters: Play either as Rorschach, a feral, street-wise fighter who can disarm enemies to use their own weapons against them, or Nite Owl, a refined fighter who uses martial arts expertise and high-tech wizardry. Fierce action: Fight and watch the blood fly through six chapters of gut-wrenching in-your-face action. Intense, visceral battles: Fight up to 20 enemies at the same time with bloody, street-fighting moves. Multiplayer: Clean up the streets with friends in split screen co-op multiplayer competition, or solo. [Deadline Games]",8.0
357,Braid,PC,"Braid is a puzzle-platformer, drawn in a painterly style, where the player manipulates the flow of time in strange and unusual ways. From a house in the city, journey to a series of worlds and solve puzzles to rescue an abducted princess. In each world, you have a different power to affect the way time behaves, and it is time's strangeness that creates the puzzles. The time behaviors include: the ability to rewind, objects that are immune to being rewound, time that is tied to space, parallel realities, time dilation, and perhaps more. Braid treats your time and attention as precious; there is no filler in this game. Every puzzle shows you something new and interesting about the game world. Braid is a 2-D platform game where you can never die and never lose.",8.6
8862,Masters Of Anima,PC,"Delve into an original adventure and defy the forces of evil in strategic, action-packed battles. Summon and control large armies of up to 100 Guardians thanks to intuitive and innovative gameplay and make quick tactical decisions to prevail.",5.2
10329,Raiders Of The Broken Planet,Xbox One,"This new game is a multiplayer 4 vs 1 asymmetrical third person shooter that features a distinctive blend of shooting, brawling and thinking man’s strategy. We think this game is a mouth-watering proposition to gamers looking for an immersive, cinematic story coupled with intense and epic online action.",5.8
10069,Fallout 3: Mothership Zeta,PC,"Defy hostile alien abductors and fight your way off of the massive Mothership Zeta, orbiting Earth miles above the Capital Wasteland. Mothership Zeta takes Fallout 3 in an entirely new direction - outer space. Meet new characters and join with them in a desperate bid to escape the Aliens' clutches. To do so, you'll wield powerful new weapons, like the Alien Atomizer, Alien Disintegrator, and Drone Cannon, and deck yourself out in brand new outfits, like the Gemini-Era Spacesuit and even Samurai Armor. A strange Alien signal is being broadcast throughout the Capital Wasteland, originating from a crashed UFO. Is it a distress call, or something far more sinister? That question is answered when you find yourself beamed aboard an enormous Alien spacecraft, with only one alternative - to fight your way to the bridge of the ship and secure your escape. [Bethesda Softworks]",5.6
2216,Skylanders Swap Force,PlayStation 3,"In Skylanders SWAP Force, Portal Masters embark on an adventure in the mysterious Cloudbreak Islands, where a magical volcano gives the heroes the power to swap halves, turning them into a special team known as the SWAP Force. By reassembling this team, Portal Masters must send back Kaos and his evil plan to Cloudbreak in order to save Skylands.",5.7
5081,Spider-Man: Web Of Shadows,DS,"New York City has been invaded and only Spider-Man can save it. The fate of New York is in your hands...Take Control. Spider-Man: Web of Shadows gives you an unprecedented level of gameplay choice, including, for the first time, control over the game's direction and outcome. Choose how Spider-Man fights, which powers to upgrade, who in the Marvel universe to fight with or against, and the fate of New York City itself. Choose wisely. [Activision]",7.3
14823,Ghostbusters: Sanctum Of Slime,Xbox,Sanctum of Slime is a top-down action adventure following the star of 2009's Ghostbusters revamp.,3.4
5493,Va-11 Hall-A: Cyberpunk Bartender Action,PC,"VA-11 HALL-A: Cyberpunk Bartender Action is a booze em' up about waifus, technology, and post-dystopia life.",8.4
11427,Dusk Diver,PlayStation 4,"When an unstable dimensional rift brings together Gods, Phantoms and Humans, headstrong highschool girl Yang Yumo must step up to protect the neighborhood. Fight alongside your guardians as part of a dynamic action-oriented combat system in the bustling streets, stores, personalities and even cuisines of Taipei.",7.2
4031,A Way Out,Xbox One,"The story of A Way Out begins in prison with two separate inmates, Leo and Vincent, who don’t know each other. While their individual stories progress, players have to build a relationship based on trust as they break both men out of prison into the world beyond. This co-op only experience is meant to be played together with a friend on a couch or online. A Way Out is a game uniquely tailored for two players to work together no matter the situation. Through a compelling narrative, Leo and Vincent will embark on an emotional adventure, where they live some memorable action moments that they face together including car chases, stealth passages, melee fights, shootouts and many more. [Electronic Arts]",7.8
12534,Star Wars: The Force Unleashed,DS,"Star Wars: The Force Unleashed casts players as Darth Vader's ""Secret Apprentice"" and promises to unveil new revelations about the Star Wars galaxy. The expansive story, created under direction from George Lucas, is set during the largely unexplored era between ""Star Wars: Episode III Revenge of the Sith"" and ""Star Wars: Episode IV A New Hope."" In it, players assist the iconic villain in his quest to rid the universe of Jedi - and face decisions that could change the course of their destiny. Unleash and upgrade the Secret Apprentice's four core Force powers - Force push, grip, repulse and lightning - throughout the course of the game, and combine them for ultra-destructive, never-before-seen combos. The Secret Apprentice doesn't just Force push enemies into walls - he Force pushes enemies through walls. The Secret Apprentice doesn't just Force grip foes to throw them aside - he Force grips them in midair, zapping them with lightning, then dropping them to the ground to explode like a bomb. In addition to new adversaries created just for the game, such as fugitive Jedi and Force-sensitive Felucians, players also confront and associate with familiar faces from the Star Wars films, including Darth Vader. Visit locations such as Episode III's Wookiee homeworld Kashyyyk and the floral Felucia, the junk planet Raxus Prime, plus an Imperial TIE fighter construction facility. Decisions made by players throughout the game determine the path of the story, including multiple endings that will rock Star Wars continuity as they know it. [LucasArts]",5.5
14097,Pirates Of The Caribbean: The Legend Of Jack Sparrow,PlayStation 3,"A sequel to the original Pirates of the Caribbean, Pirates of the Caribbean: The Legend of Jack Sparrow features a blend of fast-paced action and adventure that captures the entertaining characters, settings, and spirit of the first movie. Piracy, smuggling, buried treasure (not to mention kidnapping, sword fighting looting, pilfering, and other acts of villainy)...what's not to love about Captain Jack Sparrow? Jack Sparrow is the ultimate video game character - with his cocky swagger and his offbeat personality - and players are be able to experience his adventures first hand in this action game. Gamers slash and hack their way through a dozen locations, with fully interactive levels and varied gameplay. The action takes place in a variety of lush, immersive settings, including burning buildings, wrecked ships, and misty moonlit caves. The gameplay experience finds gamers fighting hordes of their enemies one minute, while in the next they're evading capture by the Royal Navy. Gamers learn new moves and combos as the game progresses, allowing even more spectacular, and deadly attacks during combat. [Bethesda Softworks]",7.4
3784,Untitled Goose Game,PlayStation 4,"It's a lovely day in the village, and you are a horrible goose. Untitled Goose Game is a slapstick-stealth-sandbox, where you are a goose let loose on an unsuspecting village. Make your way around town, from peoples' back gardens to the high street shops to the village green, setting up pranks, stealing hats, honking a lot, and generally ruining everyone’s day.",6.9
4110,Mortal Kombat: Deadly Alliance,PlayStation 2,"Deadly Alliance features a completely new fighting system. Each warrior has three unique fighting styles including hand-to-hand and deadly-weapon combat adding a whole new strategy to Mortal Kombat fighting. Full 3D movement with extremely realistic fighting effects are included, with ripped clothing, bruises, sweat-dripping and blood. Brutal Fatalities are back with gruesome and bloody detail first time seen on next-generation systems. Character-specific ""special attacks"" such as Scorpion's deadly spear move are also here. Over 20 new and old favorite characters . Returning: Johnny Cage, Kung Lao, Raiden, Sonya, Scorpion and more. New: Female Sub-Zero, Moloch, Mavado and more. [Midway]",8.4
2021,No More Heroes,Wii,"No More Heroes tells the story of Travis Touchdown, an anime fan who lives in the fictional town of Santa Destroy, California. After an unexpected turn of events, Travis finds himself at the bottom of an Assassins' organization. Travis will have to prove himself worthy and defeat 10 other bloodthirsty killers – all with deep stories of their own – to make his way to the top of the assassin's league. [Ubisoft]",8.5
7233,Railway Empire: Switch Edition,Switch,"United States, 1830: The New World is in its ascendancy. Industry is booming, and the race is on to establish the most dominant and powerful rail empire in all of North America. It's time to outthink and outmaneuver your competitors as you lead your company into the 20th century! In Railway Empire, you will create an elaborate and wide-ranging rail network, purchase over 40 different trains modelled in extraordinary detail, and buy or build railway stations, maintenance buildings, factories and tourist attractions to keep your travel network ahead of the competition. You'll also need to hire and manage your workforce if you want to ensure an efficient train service, whilst also develop over 300 technologies ranging from mechanical improvements to the trains themselves to workplace infrastructures and advanced amenities as you progress through five eras of technological innovations. However, you can't just build and research your way to the top -- the competition never sleeps, and to keep your business on track you'll have to survive against up to three rival tycoons. To get to the top you may have to resort to more cutthroat tactics as you attack and sabotage your opponents through raids and industrial espionage.",7.2
10561,Rage 2,PlayStation 4,"Dive headfirst into a dystopian world devoid of society, law, and order. RAGE 2 brings together two studio powerhouses Avalanche Studios, masters of open world insanity, and id Software, the gods of the first-person shooter to deliver a carnival of carnage where you can go anywhere, shoot anything, and explode everything. THE LAST RANGER Bring the pain using a collection of upgradable weapons, devastating Nanotrite powers, and Overdrive, the ability to push your guns beyond their mechanical limits. PEDAL TO THE METAL From monster trucks to gyrocopters, use an assortment of rugged and wasteland-ready vehicles to speed across the badlands. If you see it, you can drive it. FACTIONS & FOES Fight against ferocious factions for control of the wasteland, each featuring a rogue's gallery of madmen, mutants, and monsters hungry for blood. THE WASTELAND AWAITS Seamlessly traverse a vast and varied landscape, from lush jungles and treacherous swamps to sun-scorched deserts in your pursuit of The Authority. The wasteland is massive, and you've got the arsenal to fight for every inch.",6.0
