,name,platform,summary,user_review
8127,The Red Star,PlayStation 2,"Over the course of several generations, the once mighty empire known as The United Republics of The Red Star (U.R.R.S.) slaughtered millions of its own people by the order of a single man. This man was their leader, Imbohl; a mighty sorcerer whose insanity turned his people's Utopian dreams into a nightmarish scheme driven by the desire to forge his own immortality. Haunted by the ghosts of their nation's tragic past, the Heroes of the Red Star, at the battle of Kar Dathra's Gate, discover the true nature of their people's struggle, abandon their duties as soldiers of the Red Fleet, and embark upon a quest to liberate their people from Imbohl's dark legacy. [Acclaim]",8.3
2536,Lunar Knights,DS,"Descend into the gothic Sci-Fi world of Lunar Knights and take control of two warriors on a quest to reclaim the world from the vampiric legion. Spin together tornados, guide down flaming meteors, and blow together snowstorms in Kojima Productions first ever title on the DS. Two different heroes with unique powers and weapons. In-game day/night cycle and weather affects gameplay. Use the touch pen to solve puzzles and guide your vehicle through 3D shooter mini games. [Konami]",7.8
9630,Sonic And The Secret Rings,Wii,"The game opens as Sonic is mysteriously transported to the world of The Arabian Nights where he encounters a mystical genie, Shahra. Shahra pleads with Sonic to save her world from the powerful evil genie, Erazor Djinn. As the story unfolds, Erazor confronts Sonic and pulls him into his evil plans. Sonic has a limited time to deliver Erazor the seven World Rings and save the storybook world. Navigating a world full of obstacles and enemies, from Erazor’s genie minions to dinosaurs, players use a bevy of core moves to keep up the pace. Holding the Wii Remote horizontally, players tilt the controller left and right to control Sonic's signature speed. They jump, perform sliding stops, pull off wicked homing attacks with a snap of the controller, and even walk backwards with a tilt of the Wii Remote. Players also hop aboard winged pots and fly with a vigorous shake of the controller. They launch themselves from catapults with a whip of the Wii Remote, surf through rapids on tree trunks and even pilot flying carpets in the race to restore this storybook world before all is lost. Players navigate 100 missions within eight wildly varied worlds, gaining new moves and abilities along the way. As players progress through the game, Sonic's abilities can be strategically equipped based on the demands of the mission ahead. From a boost called Speed Break to an ability called Time Break that slows the world around him to a near stop, Sonic needs every trick in the book to make sure Erazor Djinn stays in the storybook world. In addition to the single player adventure, Sonic and the Secret Rings offers 40 mini-games that support up to four players. Showcasing the abilities of the Wii Remote, players will use the controller as a violin bow, an ax, a canoe paddle and dozens of other motions to compete in these easy to pick-up-and-play games. [Sega]",6.2
14301,The Sims 2: Apartment Pets,PC,"Live in the most pet-friendly apartment around. Your Sim is moving into an apartment building full of interesting neighbors and a wide variety of pets. From loveable cats and dogs to all-new exotic animals including slithery snakes, colorful birds, and cuddly rabbits, your Sim will experience all the fun of playing with pets while enjoying their new apartment lifestyle. Run your very own pet spa to groom and dress pets. Share your apartment with dogs, cats, snakes, rabbits, and more. Meet interesting neighbors and take care of their pets. Play fun mini-games to unlock toys, clothing, furniture, and accessories. [Electronic Arts]",2.2
15074,Balan Wonderworld,Switch,"Balan Wonderworld is a wondrous action-platformer game themed around a mysterious musical theatre. The stars of the show will use special abilities from a multitude of characterful costumes as they adventure in the bizarre and imaginary land of Wonderworld. Here memories and vistas from the real world mix with the things that people hold dear. Twelve different tales await our stars in Wonderworld, each with their own unique quirks. They will explore all corners of these labyrinthine stages, using all the tricks and gimmicks hidden along the way, to get to the heart of each touching story.",4.8
12922,Lego Battles: Ninjago,DS,"Produced by critically acclaimed TT Games and developed by Hellbent Games, LEGO Battles: Ninjago allows players to become a master of Spinjitzu, an art form in which characters spin and become tornadoes to defeat their enemies, as they restore harmony to the world. Players can choose to play both ""good"" and ""evil"" single-player campaigns, test their skills in a variety of Battle Mode challenges, or play with family and friends in exciting multiplayer showdowns.",7.9
3484,The Mark Of Kri,PlayStation 2,"Set in richly detailed 3D environments, each with its own distinct styles and themes, Rau, a fierce warrior, must battle the denizens of the dark world to prevent the invoking of an ancient spell that holds the power to unleash great evil throughout the land. Along with his loyal and trusted spirit guide, Kuzo, a large black bird, Rau embarks on an exhilarating journey that requires a combination of stealth, aggressive-action moves and calculated planning. Kuzo plays a strategic role in the quest with the ability to scout ahead to perches for a better view of looming danger, retrieve items and distract opponents. [SCEA]",7.6
8934,Crossing Souls,PC,It’s 1986 in California. A group of friends discover a mysterious pink stone that allows to travel between two realms. This gang will live the summer of their lives in an adventure that will get them involved in a government conspiracy. Control five kids with specials skills while fighting and solving puzzles.,6.6
1493,West Of Loathing,Switch,"West of Loathing is a single-player slapstick comedy adventure role-playing game set in the wild west of the Kingdom of Loathing universe. Traverse snake-infested gulches, punch skeletons wearing cowboy hats, grapple with demon cows, and investigate a wide variety of disgusting spittoons. Talk your way out of trouble as a silver-tongued Snake Oiler, plumb the refried mysteries of the cosmos as a wise and subtle Beanslinger, or let your fists do the talking as a fierce Cow Puncher. Explore a vast open world and encounter a colorful cast of characters, some of whom are good, many of whom are bad, and a few of whom are ugly. [Nintendo]",8.1
11518,Ys: The Ark Of Napishtim,PSP,"Washed ashore on an uncharted island, Adol Christin begins a new journey in Ys: The Ark of Napishtim. Lush environments, beautifully rendered characters and animated 3D backdrops combine to create the setting for Adol's newest adventure. Now on the PSP, our red-headed hero must fight deadly monsters and menacing bosses with a variety of sword combinations, special attacks and magical spells to uncover the secrets that lie in Canaan's mysterious whirlpools. Power-up three magical swords to gain special abilities and attacks. Combines real-time, fast-paced action and strategic boss battles. Unlock and play fun new mini-games with characters from the island. Play soundtrack & view character profiles in brand new modes. [Konami]",7.4
2894,The Elder Scrolls V: Skyrim Special Edition,PlayStation 4,"Skyrim Special Edition brings the epic fantasy to life in detail. The Special Edition includes the game and add-ons with all-new features like remastered art and effects, volumetric god rays, dynamic depth of field, screen-space reflections, and more.",7.6
12597,Dynasty Warriors: Gundam,PlayStation 3,"(Known as ""Gundam Musou"" in Japan) In the future, rebel space colonies launch a brutal war for independence with a series of orbital strikes against the Earth. War is reinvented as advanced ECM renders long range sensors and communications virtually useless. In this chaos, a frightening new weapon, the Mobile Suit, is born. Agile, heavily armed and armored - optimized for short range combat with melee attacks and a wide array of weapons, the Mobile Suit is the ultimate instrument in this new age of warfare. The time has come to pick a side, choose a weapon and prove your supremacy. Dynasty Warriors:GUNDAM takes gamers through an intergalactic conflict where the only hope for survival is to annihilate the encroaching opposing forces. It's a one-versus-many as gamers fight at lightning speed aboard their favorite Mobile Suit, the ultimate weapon of war. Gamers can explore the rich and detailed setting of the Gundam multi-verse from a myriad of perspectives. Assume the role of legendary heroes and villains while strategically enhancing their power, skills, and abilities. Play out the legendary scenes from the rich storyline and marvel at the subtle twists viewed through the eyes of each character. Furthermore, unlock Mobile Suits and Pilots from different Gundam universe time lines while accomplishing secret missions adding limitless replayability. With a variety of game types including Official, Original and Versus Mode, gamers must overcome impossible odds to bring their Mobile Suits to victory. [Namco Bandai / Koei]",7.1
12543,Arkanoid Ds,DS,"Explore three game modes that offer varied gameplay designed for a wide range of users. Compete against others with two or four person multiplayer options to claim the title of ARKANOID DS champion. Decorate ARKANOID DS with colorful designs by trading points gained through gameplay for fun backgrounds and icons. Rock to an irresistible soundtrack produced by Zuntata, TAITO’s award-winning sound team. [Taito]",7.7
5118,Letter Quest: Grimm'S Journey Remastered,Xbox One,"The grim reapers Grimm and Rose need your help to defeat a legion of monsters, ghosts, and evil bunnies using the power of words. Spell words to battle monsters and earn gems that can be used to purchase upgrades, books, special items, potions, and more Letter Quest is a turn-based RPG featuring high-res artwork, clever wordplay, and two great soundtracks. Use your linguistic skills to survive. [Xbox.com]",6.0
10784,Aeon Flux,PlayStation 2,"Aeon Flux is based on Peter Chung's popular futuristic MTV animated series and features a palpitating blend of stealth, speed and acrobatic combat. As beautiful as she is lethal, Aeon Flux is an agent whose abilities transcend everyday belief; she will depend upon those skills and talents to rid the city of Bregna from an evil tyranny. Paramount Pictures'/Lakeshore Entertainment's Aeon Flux is set 400 years in the future, when disease has wiped out the majority of the earth's population except for one walled, protected city-state, Bregna, ruled by a congress of scientists. The story centers on Aeon Flux (Charlize Theron), the top operative in the underground 'Monican' rebellion, led by The Handler (Frances McDormand). When Aeon is sent on a mission to kill a government leader, she uncovers a world of secrets. [Majesco]",6.2
8870,Summon Night 6: Lost Borders,PlayStation 4,"Summon Night 6: Lost Borders weaves an emotional tale of friendship and discovery that begins in the sparsely populated “cocoon world” of Fillujah, where the three main characters (Raj, Amu and Ist) live in virtual isolation.",6.9
6650,Afterparty,Xbox One,"In Afterparty, you are Milo and Lola, recently deceased best buds who suddenly find themselves staring down an eternity in Hell. But there’s a loophole: outdrink Satan and he’ll grant you re-entry to Earth. What adventures will you stumble through in the underworld? Every step is up to you. Time to go on the best bender ever, uncover the mystery of why you’ve been damned, and drink the big guy under the table. [Night School]",6.8
9851,Wwe 2K17,PlayStation 4,"Features thousands of new moves and animations, backstage and in-arena brawling, and the biggest roster of WWE and NXT Superstars and Legends to date. Now more than ever, you will feel like you are commanding an actual WWE broadcast! POWERFUL CREATION SUITE. Create and develop your custom WWE with the deepest Creation Suite to date, featuring new creation options such as Create a Video and Create a Victory. New features and additional content allow you to create custom Superstars, Arenas, and Championships. The power is in your hands to create your WWE. MyCAREER AND WWE UNIVERSE WITH NEW PROMO ENGINE. The all-new Promo Engine brings the drama and personality of the WWE Superstars to life in MyCAREER and WWE Universe modes. Choose your words wisely and smack talk your opponents, start rivalries or form alliances. Your words will shape your characters as they rise through the ranks of NXT and WWE, to become WWE Hall of Famers. [2K Sports]",6.1
8192,Space Hulk Ascension,PC,"Space Hulk: Ascension Edition is a 3D, digital, turn based, strategy game, which builds upon the classic board game experience, and adds new RPG style mechanics, additional weapons, enemy types, an all-new chapter and loads of other new features. Set in the isolated corridors and tomb-like chambers of ancient vessels lost in the graveyard of space, players lead a small force of fearless Space Marine Terminators in a ferocious fight for survival against hordes of predatory, alien Genestealers.",7.2
12007,Galaxy On Fire 2 Full Hd,PC,Galaxy On Fire 2 Full HD is an outer space adventure with over 20 solar systems and dozen of planets.,6.6
11337,Eternal Poison,PlayStation 2,"Our world descended into chaos the day the demonic realm of Besek appeared. Creatures known as the Majin emerged, wreaking havoc and destroying our way of life. They captured the Princess of Valdia and imprisoned her in their lair. Now, brave adventurers throughout the land have set out to explore the Majin homeland. Some wish to rescue the princess; some seek fame and glory; some merely want revenge. However, there are those who look to harness the Majin's dark powers, for it is rumored that deep within Besek lies the Eternal Poison, a legendary treasure able to make your deepest desires come true. Travel the paths of some of these adventurers, and as their tales unfold, you will discover the true meanings of romance, heroism, madness, despair, and betrayal. Five stories in one—Walk the winding paths of five different parties as they journey deeper into hostile lands. With branching paths and optional encounters, you must chart each course carefully, for your choices have a direct impact on the outcome of each tale. All demons can be exploited - even bosses - so every battle offers the intriguing choice of binding or killing your foes. Bound demons can be summoned to fight at your side or be sacrificed for money or new spells. Step into a twisted fairytale world of demons, black magic, and a quest for the ultimate treasure. The kidnapping of the Princess and the temptation of finding the Eternal Poison have drawn your heroes into a world full of dangerous traps, fiendish monsters, and unexpected villains. Discover a world that is as rich in beauty as it is in corruption. [Atlus USA]",8.6
9097,Dustforce,PlayStation 3,"In Dustforce, players stylishly flow through precarious environments, sweeping up dust, leaves, trash and slime. The cleaners face off against the fourSprites who are determined to make a mess of the whole world",6.8
10290,Serious Sam Hd: The First Encounter,PC,"The indie sensation Serious Sam: The First Encounter is reborn in glorious high-definition for legions of long-time fans and a whole new generation of gamers around the world. Featuring dazzling visuals and revamped design, gamers take control of the legendary Sam ‘Serious’ Stone as he is sent back through time to ancient Egypt to battle the overwhelming forces of Lord Mental and the Sirian army.",8.1
6959,Total Annihilation: Kingdoms,PC,"Massive armies will clash. Forests and cities will burn. Tremendous magical forces will level entire fortresses in the blink of an eye. Four completely unique races are vying for control of the mythical world of Darien, each representing one of the four elements -- Earth and Air, Fire and Water. In Total Annihilation: Kingdoms, you'll take the role of one of the four immortal monarch of these nations at war. You'll rally your legions -- swordsmen, archers and knights on horseback -- under your flag. Wizards, beasts and even flame-spewing demons will will heed your every command, waging war on an epic field of battle. The game's stunning 3D terrain of forests, magic-laden ruins and expansive oceans provide a landscape of war fraught with danger, magic and ambush. [Cavedog Entertainment]",8.4
9758,Frogger: Helmet Chaos,DS,"Frogger, one of the most beloved video game character of all time, returns! In this latest escapade, Frogger finds himself called upon to stop an evil force that threatens his home, Firefly Swamp, and the nearby kingdom of Bunnington Hollow. To stop the insidious Dr. Wani and his destructive mining efforts, Frogger must use all of his hopping and dodging skills, along with many new talents, to infiltrate the mastermind's lair and bring his evil plans crashing down. Unlock new playable characters and original arcade game. Over than 30 levels of play to challenge players of all levels. A wide range of moves including wall climbing, tongue grabs and more. Up to 4-player wireless multiplayer action with a single game cartridge. [Konami]",6.8
8839,Fruit Ninja Kinect,Xbox 360,"YOU are the ninja! The worldwide gaming phenomenon Fruit Ninja has now arrived for Kinect! Your arms are now blades, and the epic battle against the world’s most delicious produce is just beginning. Fruit Ninja Kinect is an amazing evolution of the slice-em-up genre created by Halfbrick, utlising next-gen power for the juiciest combat ever! With Classic, Zen and the frenetic Arcade Mode, Fruit Ninja Kinect includes all the action you know and love with precision control - along with special features exclusive to Kinect! With Party Mode, multiple players can turn a normal night into a fierce tournament - and the new Challenge system will reveal the true masters among your friends!",6.5
14377,Rc Revenge Pro,PlayStation 4,"rab the controls and hold on for dear life with the most electrifying, high-speed racing experience available. Race and wreck in enchanting movie-theme worlds, kick it into overdrive with over 30 super-flying vehicles, and blow away the competition with outrageous weapons in the most electrifying racing experience available! Previously known as Revolt 2: Pocket Rockets, this RC vehicle racer graces the 128-bit system with all the slick track designs, great weapons balance, and dead-on control that made the PC and Dreamcast versions such a hit. Luckily, developers from Acclaim's Cheltenham Studios have taken full advantage of the PlayStatation 2 hardware--no longer will tracks be confined to suburban neighborhoods and museums. RC Revenge goes all out to deliver the goods with environments like desert islands and villages wrapped nighttime slumber. And the best part of it all? A level editor for the creative gamer is set to keep the replay value on high.",7.6
9246,Naruto Shippuden: Ultimate Ninja Storm 3,Xbox 360,"NARUTO SHIPPUDEN: Ultimate Ninja STORM 3 promises to feature the most extensive character roster of any game so far in the series, allowing fans to engage with a vast array of their favorite personalities from the NARUTO SHIPPUDEN universe, be they friend or foe. In story mode, players are thrown into a series of adventures set in the village of Konoha, while the game's fights are punctuated with large scale boss battles, including a confrontation with the gargantuan Nine-Tails.",7.6
13003,Drive!Drive!Drive!,PlayStation 4,"A racing game in which players must drive their cars to victory across multiple tracks at the same time. To place well in every track you’re racing on, you’re going to have to hop track-to-track on a regular basis.",5.0
15075,Alekhine'S Gun,PlayStation 4,"It is the height of the Cold War, a time of global uncertainty and civil unrest. In this stealth shooter you play Agent Alekhine, a highly skilled Russian assassin driven by a moral compass that leads you headfirst into a covert operation unsanctioned by the country you serve. Working alongside American CIA agents, your mission is clear - though how you accomplish it is anything but - as the tension of a nuclear standoff grows with each passing minute. In a world where one wrong move could be the end of you, navigating a new direction comes at a price.",3.8
8994,God Eater Resurrection,PlayStation 4,"Confronting an enemy completely immune to conventional weapons, modern society is driven to the point of extinction. One last hope remains. Following the Fenrir Organization’s development of God Arcs, their wielders are organized into an elite force of God Eaters. As the newest recruit to Fenrir’s Far East Branch, discover that in times of adversity, humans will go to any length to survive in God Eater Resurrection. [Playstation.com]",7.0
8541,Hitman Hd Trilogy,PlayStation 3,"Engage in more than 40 missions from three Hitman games, each re-mastered in high definition. Whether you're a veteran or new to the franchise, this is your chance to take on the contracts that defined the series and helped establish Agent 47 as the world's deadliest assassin.",7.6
4730,Blasphemous,PlayStation 4,"Blasphemous is a punishing action-platformer that combines the fast-paced, skilled combat of a hack-n-slash game with a deep and evocative narrative core, delivered through exploration of a huge universe comprised of non-linear levels.",7.9
4100,The Touryst,Switch,"You are just arriving at the Monument Islands. Want to go swimming? Or rather take a dive into the deep sea? Or do you want to visit the amusement arcade, do some shopping, dance at the beach party? Fancy some surfing? Or will you talk with the strange old tourist and listen what he has to say about these ancient mysterious monuments..",7.9
14841,Zumba Fitness: Join The Party,Xbox 360,"Join the party with Zumba Fitness, a one-of-a-kind, dance fitness workout set to sexy, high-energy Latin and international music! Find your rhythm and let go as Zumba instructor fan favorites Gina Grant, Tanya Beardsley, and Zumba creator Beto guide you through 30 routines that will work you into a sweat and make you forget you're even exercising. Featuring exclusive music and choreography, Zumba Fitness for Kinect lets you see yourself on screen and naturally dance controller-free in an ultra fun interactive fitness party that's focused on the joy of movement!",5.5
12914,Devious Dungeon,Switch,Devious Dungeon is a medieval action platforming game by the creators of Random Heroes and League of Evil!,6.4
2085,Colin Mcrae Rally 2005,Xbox,"Colin McRae Rally 2005 offers more than 300 stages, enhanced vehicles, and the chance to race against the very best in rally racing. At the heart of the game is the all-new Career Challenge, which takes you through a full professional rally career as you drive a diverse selection of rally cars. Through the game's 23 events, you can drive cars including 4-wheel drive, 2-wheel drive, 4-wheel Classics, Super 2-wheel, Rear Wheel, Distinctive and 4x4 classics. Each rally event provides different challenges through a series of Cups, SuperCups, Shields, and Championships.",7.5
149,Nhl 2002,PlayStation 2,"The PlayStation 2 version features include Career Mode, allowing you to compete for the Stanley Cup for 10 consecutive years and build a true hockey dynasty. Also included are Quick Game, Season, Playoffs, Shootout, and Tournament modes. [EA Sports]",8.3
1957,The Sims,Xbox,"Build, buy, and live. The Sims give you the chance to create simulated people and build their homes, then help your Sims pursue careers, earn money, make friends, and find romance--or totally mess up their lives. Keep your Sims happy by decorating your home with over 150 objects in the game and downloadable ones from TheSims.com. Test your ""people skills"" as you deal with family, friends, careers, and chaos. There is no right or wrong way to play the game.",6.8
10186,Batman: Vengeance,PlayStation 2,"Become Batman with blistering martial arts combos, over 500 unique animated moves, and a multi-functional cape with its own A.I. Wield such goodies as Batarangs, Batgrapples, Flash Bombs, Remote Charges, Batcuffs, Nets, the Batlauncher, Batscope, and more. [Ubi Soft]",7.0
10762,Driveclub Vr,PlayStation 4,"Game modes: Online virtual reality multiplayer race modes and an action-packed single player career are joined by drifting and time trial challenges. Tracks: New and classic Driveclub tracks are brought to life through the power of PlayStation VR, including five all-new Urban locations. A closer look: More than 80 cars are recreated with immaculate detail for players to explore up close with Inspection Mode. Cruise control: A little time to kick back, open the throttle or just coast and explore any track, in any country at your leisure in Cruise Mode. Virtual passenger: An immersive thrill ride through exciting replays of hot laps as players watch themselves handle their greatest challenges from a unique viewpoint in Passenger Mode. [Playstation.com]",6.7
10000,Mx Vs. Atv Unleashed: On The Edge,PSP,"In MX vs. ATV Unleashed, players power through all-new environments and event types, choosing from a variety of new vehicles. A redesigned monster truck, powerful sand-rail and raised 4x4 golf karts meet ATVs, dirt bikes and bi-planes to compete in massive free-world environments featuring hill climbs, machine challenges and short track races. The game's career mode allows gamers to choose from the top professional ATV and Motocross riders. [THQ]",8.1
